{
  "batch_count": 3,
  "evidence_unit_count": 29,
  "evidence_unit_ids": [
    "ev_056dc8b7b9e72edf091f",
    "ev_0fe80954e95f7fb477e8",
    "ev_13d523821b593dc3595b",
    "ev_1e9b8f0e5619ab8c65e0",
    "ev_34818f580466c6adde14",
    "ev_5433fb9ece474861fd30",
    "ev_5dba958b51069667e5ba",
    "ev_688a5c1d29a93d4f67b9",
    "ev_692a15a6856df4a9484c",
    "ev_6d593181349d505edfb2",
    "ev_77ff16b86a91f6aa4b0c",
    "ev_7b513d3be05ca22d959d",
    "ev_8431641a3e942e9a3fa9",
    "ev_8fa3cc97dbb13d32f5aa",
    "ev_91e413f88fab19b30183",
    "ev_9b80a2890808f351bc77",
    "ev_a1bdca8d62326a3adab0",
    "ev_a2d9926fb7998e3192c1",
    "ev_a9eb95364a7c4ecaeea8",
    "ev_aaa44f72428e556bc6f8",
    "ev_ac4d12dfff4f0d41371d",
    "ev_ae859501d07e5d1b13f4",
    "ev_d02003ef7a3989458d90",
    "ev_d9860efd486db5021956",
    "ev_dd6b9b1e7a01d0f5d59c",
    "ev_e184c02fa9909a06fe7b",
    "ev_ef730605fc6bc070635c",
    "ev_f9f5fead7a9f17340a02",
    "ev_fe6dc4a05d59af3cf5ec"
  ],
  "module_count": 3,
  "phase3_artifact_hashes": {
    "architecture_validation_report.json": "a0d582e087603d0c1935d2a124de2ef09537c254ebef9e0815bde3c5166b6cf8",
    "creative_fit_report.json": "256408699ff9422546a5692252ffb279683c1dd0a201982fbfa4060646f2efe8",
    "creative_template_architecture.json": "32962b26971ac11fab62a6a8bdd4b66659eef03437fe6bb2115d98a5c4262740",
    "design_invariants.json": "c31856ada92e57af6169cdf41e3236663f4bbc195ff2a5e7901084c892420402",
    "evidence_allocation_report.json": "b60610be69d4779860ee5a1259c1e649b87a4b279076d47af9cb2b89114ad8e1",
    "evidence_unit_registry.json": "efe53f82b6aa5b770cc1998a330a369450de6dd68e47efcbdd95917fa3a38964",
    "input_request.json": "ff70ee49ad82eb3f08043613408118af6d9412ed0c2893499cef358b7ebd3539",
    "module_art_directions.json": "c5b08542b43865843fbc6d317ead7d6d0bf9fba5ea2eb6cdb650e313e22eca68",
    "presentation_architecture.json": "1bb3ce9d7676f528219eaac1c3addea72f145fb3cb3997ae4c905b7fdf73e906",
    "presentation_plan.json": "333eedcc3f71f7b3d59299acc3e72eb55ab85f65f4d7e00bbe8141fa2c058ac2",
    "slide_blueprint_collection.json": "60ec2766bcc5539d8a4fe30b56510659ad096c442b0b213d64611bcecadb747f",
    "source_corpus.json": "f256734dc1a4b24a41350a0a66c3585aabe67a229f937ce2bf4209eadae5e295",
    "source_coverage_report.json": "29cc1d6807049c38e44797931a69e4395ce23e00c7428253b14ee5c60c4f3845",
    "source_gap_report.json": "e59d8734030f724dfdc2340b3c443cd88662c473161c3fb7d0db58f61b7f1369",
    "source_locators.json": "b7d6990ee03462ab0a4bf3d9417f7ae394cceb1bd77dbf3571d84b192849a1d8",
    "workflow_resolution.json": "12e3fdeb6b732dcf2400cc054bab193ec8c9e3a2364ccf0c9a9f2e8e8620a332"
  },
  "phase3_run_id": "run_c44021b3df14c9f658de",
  "phase3_verdict": "GO",
  "schema_name": "phase4_input_provenance",
  "schema_version": "1.0.0",
  "slide_count": 6,
  "source_commit": "00fefe71e3b02fa897794f9e9f3d6df5be715cd8",
  "source_count": 3
}
